index,value
0,create drop-down list options
1,try examples
2,select element create drop-down list
3,select element form collect user input
4,attribute needed reference form data form submitted omit attribute no data drop-down list submitted
5,id attribute needed associate drop-down list label
6,option tags inside select element define available options drop-down list
7,tip add label tag best accessibility practices
8,select tag supports global attributes html
9,select tag supports event attributes html
10,use select optgroup tags
11,html dom reference select object
12,css tutorial styling forms
13,none
14,launchedw3schools videos
15,certifiedby completinga course today
16,want report error want suggestion hesitate send e-mail
17,help w3schools.com
18,message sent w3schools
