index,value
59,musk criticized public comment conduct related covid-19 pandemic spread misinformation including promoting chloroquine assuming death statistic manipulated start pandemic claimed child essentially immune sars-cov-2 coronavirus twitter determined given overall context conclusion tweet break rule covid-19 commentary decision described irresponsible verge
60,musk called coronavirus panic dumb musk repeatedly criticized lockdown violated local order re-opening tesla fremont factory march commenting new york time report china reported new case domestic spread novel coronavirus musk predicted probably close new case end april politico later labeled statement audacious confident spectacularly incorrect prognostication november phrase space karen trended twitter connection musk tweeted misinformation effectiveness covid-19 testing
61,march musk offered donate ventilator tesla build buy third party multiple hospital noted device eventually donated bipap cpap machine expensive sought-after invasive mechanical ventilator imv machine device free ventilator sickest patient invasive ventilator cost cpap machine purchased
62,finding antibody-testing program spacex worked doctor academic researcher create published nature communication musk listed co-author
63,musk frequently spoken potential danger artificial intelligence ai repeatedly calling greatest threat humanity musk opinion ai provoked controversy criticized expert yann lecun consequently according cnbc musk looked favorably ai research community mark zuckerberg clashed musk issue zuckerberg calling warning pretty irresponsible musk claim human live computer simulation criticized
64,december prompted opinion virtual reality vr driven musk said unable compelling metaverse situation remarked think far disappearing metaverse sound kind buzzword-y sure tv nose sure make metaverse strapping frigging screen face day wanting leave way
65,company dealing area transportation musk criticized public transportation stance called elitist public mode transportation provide service person car rent drive december response audience question public transit urban sprawl tesla event sideline neural information processing system conference long beach california musk remarked
66,premise good thing painful think public transport painful suck want lot people leave want leave start want start end want end time
67,pain as bunch random stranger serial killer ok great people individualized transport go want want
68,audience member responded public transportation work japan musk shot cram people subway sound great
69,comment sparked widespread criticism transportation urban planning expert pointed public transportation dense urban area economical energy efficient requires le space private car
70,musk met wife canadian author justine wilson attending queen university married contracted malaria vacation south africa nearly died child son nevada alexander musk died sudden infant death syndrome sids age week death couple decided use ivf continue family twin xavier griffin born april followed triplet kai saxon damian couple divorced share custody son
71,musk began dating english actress talulah riley september couple married dornoch cathedral scotland announced divorce riley musk riley remarried december filed second divorce riley action second divorce finalized musk dated amber heard month reportedly pursuing musk later accused johnny depp having affair heard married depp musk heard denied affair
72,musk canadian musician grime revealed dating grime gave birth son according musk grime x æ a-12 violated california regulation contained character modern english alphabet changed x æ a-xii drew confusion æ letter modern english alphabet child eventually named x a-xii musk x ae a-xii middle musk surname musk confirmed report couple semi-separated september interview time december said single march grime said relationship musk probably refer boyfriend fluid revealed daughter exa dark sideræl musk nicknamed y born december surrogate later month grime tweeted musk broken best friend love life
73,early late musk resided california tesla spacex founded headquarters located moved texas stating california complacent economic success hosting saturday night live musk stated syndrome
74,musk multiple cameo appearance film iron man men black international television series appeared include simpson musk fell earth big bang theory platonic permutation south park member rick morty crew crewcoo morty saturday night live contributed interview documentary racing extinction herzog-directed lo behold
75,china elon musk trademark phenomenon according scmp different company having registered trademark english chinese transliteration multitude product including printing restaurant textile design
76,musk elected fellow royal society fr received honorary doctorate engineering technology yale ieee honorary membership award contribution development falcon rocket include american institute aeronautics astronautics george low transportation award fédération internationale gold space medal royal aeronautical society gold medal listed time magazine influential people musk selected time person year time editor-in-chief edward felsenthal wrote person year marker influence individual influence musk life earth potentially life earth musk elected member national academy engineering f breakthrough design engineering manufacturing operation reusable launch vehicle sustainable transportation energy system
